"artist","song_name","song_id","streams","date"
"J Balvin, Willy William","Mi Gente","2rb5MvYT7ZIxbKW5hfcHx8",184830,"2017-09-16"
"Danny Ocean","Me Rehúso","6De0lHrwBfPfrhorm9q1Xl",158416,"2017-09-16"
"J Balvin, Jowell & Randy","Bonita","693iqPOQvhI7PobtR8CC8v",149235,"2017-09-16"
"Becky G, Bad Bunny","Mayores","7JNh1cfm0eXjqFVOzKLyau",140493,"2017-09-16"
"Ozuna","Se Preparó","1m69ELEgE6k5ZWsap40ozt",132994,"2017-09-16"
"Wisin, Ozuna","Escápate Conmigo","2cnKEkpVUSV4wnjQiTWfH6",132586,"2017-09-16"
"Nacho, Yandel, Bad Bunny, Mambo Kingz, DJ Luian","Báilame - Remix","3VClLWqNn80Llv0PJOsKgr",130721,"2017-09-16"
"Maluma","Felices los 4","0qYTZCo5Bwh1nsUFGZP3zn",127020,"2017-09-16"
"Romeo Santos, Daddy Yankee, Nicky Jam","Bella y Sensual","0ERbK7qVqveCaBWIiYCrl3",125373,"2017-09-16"
"Manuel Turizo","Una Lady Como Tú","7MHN1aCFtLXjownGhvEQlF",113729,"2017-09-16"
"Chris Jedi, J Balvin, Ozuna, Arcangel","Ahora Dice","22eADXu8DfOAUEDw4vU8qy",106240,"2017-09-16"
"Yandel","Explícale (feat. Bad Bunny)","1LszjjoVwDDZcWUQbzeDLG",103366,"2017-09-16"
"CNCO, Yandel","Hey DJ","209gZgcfLq2aUuu51vOWBl",100833,"2017-09-16"
"Wisin, Ozuna, Bad Bunny, De La Ghetto, Arcangel, Noriel, Almighty","Escápate Conmigo - Remix","5P45f6HakSHDwdFj5dO5K5",94280,"2017-09-16"
"Carlos Vives, Sebastian Yatra","Robarte un Beso","4z3GJkrtH97Bj6fRta983T",93047,"2017-09-16"
"Ozuna","Tú Foto","5zSOVwaY3sVjnmLhuEfsuf",92480,"2017-09-16"
"Yandel","Como Antes (feat. Wisin)","5YzA563GXTuwQaRq24z1k5",87415,"2017-09-16"
"Anuel AA","Sola (Remix) [feat. Daddy Yankee, Wisin, Farruko, Zion & Lennox]","5q2JbCNi4FcnglgPfxcV65",87136,"2017-09-16"
"Alex Sensation, Ozuna","Que Va","7ofxPmTNMj2GP07g1VZa0O",83647,"2017-09-16"
"Ozuna","El Farsante","5EId1m4DNwTf3at31w8bPJ",81364,"2017-09-16"
"Zion & Lennox","Otra vez (feat. J Balvin)","3QwBODjSEzelZyVjxPOHdq",81210,"2017-09-16"
"Piso 21","Besándote","13X0XdLMOdtbXVtAj2ox4h",81024,"2017-09-16"
"J Balvin","Sigo Extrañándote","6qDF4wWL49CAVbgT7yuHl8",78384,"2017-09-16"
"Nacho","Báilame","7lRsNbdOGykkMAgsqs4R1C",77788,"2017-09-16"
"Natti Natasha, Ozuna","Criminal","2SmgFAhQkQCQPyBiBxR6Te",74216,"2017-09-16"
"Abraham Mateo, Farruko, Christian Daniel","Loco Enamorado","4N1c5rmWOzRmB9SMacr5wB",74009,"2017-09-16"
"Ed Sheeran","Shape of You","7qiZfU4dY1lWllzX7mPBI3",71880,"2017-09-16"
"KAROL G, Bad Bunny","Ahora Me Llama","61HHDBLqF3AmSvLfHKNGd2",68748,"2017-09-16"
"Nicky Jam","Si Tú La Ves (feat. Wisin)","4yN6xPLopmTLvc27pO9LIE",68151,"2017-09-16"
"Jesse & Joy, Gente De Zona","3 A.M.","0yyZN5ASdrYu0XYWFzfxUu",67614,"2017-09-16"
"Luis Fonsi","Despacito (Featuring Daddy Yankee)","4aWmUDTfIPGksMNLV2rQP2",67014,"2017-09-16"
"Ozuna","Bebe (feat. Anuel AA)","6SIrNxmmdbv1KUbFBu1PaN",66961,"2017-09-16"
"Farruko, Bad Bunny, Rvssian","Krippy Kush","7FfpP3YZ6fOWMdxkIAtud9",66823,"2017-09-16"
"Piso 21","Me llamas (feat. Maluma) - Remix","5hEM0JchdVzQ5PwvSfITeX",65141,"2017-09-16"
"Daddy Yankee, Ozuna","La Rompe Corazones","4okba5wu9mMLXx79DXLKi3",62927,"2017-09-16"
"Don Omar, Zion & Lennox","Te Quiero Pa´Mi","3BY2mafsbsoKGqS380Xnuz",60165,"2017-09-16"
"Maite Perroni","Loca (feat. Cali y El Dandee)","05ZXXyeZFhZtA6DAP3Aw7x",57902,"2017-09-16"
"Nicky Jam","El Amante","3umS4y3uQDkqekNjVpiRUs",54734,"2017-09-16"
"Rombai","Cuando Se Pone a Bailar","1MpKZi1zTXpERKwxmOu1PH",53974,"2017-09-16"
"CNCO","Reggaetón Lento (Bailemos)","3AEZUABDXNtecAOSC1qTfo",53628,"2017-09-16"
"Anuel AA","Ayer 2 (feat. Dj Nelson, J Balvin, Nicky Jam, Cosculluela)","5ZF3889W92eTBOROe0lPNN",53067,"2017-09-16"
"Jason Derulo","Swalla (feat. Nicki Minaj & Ty Dolla $ign)","6kex4EBAj0WHXDKZMEJaaF",52914,"2017-09-16"
"Bad Bunny","Soy Peor Remix (feat. J Balvin, Ozuna & Arcangel)","4UG962ViiLqoUyx0RjCcwP",51505,"2017-09-16"
"Shakira","Me Enamoré","4qknM1pQz53QOyfDVTjcM9",49874,"2017-09-16"
"Pusho, Ozuna, Wisin","La Realidad (Remix)","2PgsOTPkF25VJ9cZmUjSKE",49440,"2017-09-16"
"Gigolo Y La Exce","Sexto Sentido (feat. Bad Bunny)","3iDPALl8BoUbuXZgy6EOWY",49163,"2017-09-16"
"Joey Montana, Sebastian Yatra","Suena El Dembow","5TysCiZtv1HnSWcTcUFusI",48442,"2017-09-16"
"Ozuna, Bad Bunny, Farruko, Ñengo Flow","Diles (feat. Arcangel, Nengo Flow, Dj Luian & Mambo Kings)","2FrnTVSHjgnEylKGdHRUK1",48102,"2017-09-16"
"Hugo Lagos","El Guatón Loyola","0Q8uS8c6cXBO03cyQcv3Xn",47438,"2017-09-16"
"Bad Bunny","Tu No Metes Cabra","10nQ3Pj0o1XotcikgJPVKD",47431,"2017-09-16"
"Brytiago, Bad Bunny","Netflixxx","5gFAT2DbEt4TOMXyAMEixG",47260,"2017-09-16"
"Hugo Lagos","La Consentida","6WBAwTrUIwWJTlS8e3v5Zx",46771,"2017-09-16"
"Wisin","Vacaciones","3dQDid3IUNhZy1OehIfYfE",44235,"2017-09-16"
"Pitbull","Hey Ma (with Pitbull & J Balvin feat. Camila Cabello) - Spanish Version","2Vdub5mY4lad7w64bFPUez",43801,"2017-09-16"
"Dua Lipa","New Rules","2ekn2ttSfGqwhhate0LSR0",43299,"2017-09-16"
"Mon Laferte, Juanes","Amárrame","0u13src3QcditRU5VPduML",42615,"2017-09-16"
"Major Lazer","Buscando Huellas (feat. J Balvin & Sean Paul)","6WMYFEd4MJDIjJARHnOxoN",38914,"2017-09-16"
"IAmChino, El Chacal","Ay Mi Dios (feat. Pitbull, Yandel & Chacal)","6stYbAJgTszHAHZMPxWWCY",38331,"2017-09-16"
"Taylor Swift","Look What You Made Me Do","6uFsE1JgZ20EXyU0JQZbUR",37755,"2017-09-16"
"J Balvin, Bad Bunny","Si Tu Novio Te Deja Sola","0RFFFGtPn6a58RHY3ccVYX",37531,"2017-09-16"
"Romeo Santos","Imitadora","6r46lnXFbE9fr2d3KNaGbe",36900,"2017-09-16"
"David Guetta","2U (feat. Justin Bieber)","3A7qX2QjDlPnazUsRk5y0M",36579,"2017-09-16"
"Tito Fernández","Pa' Temuco Mi Cueca","1krAFMg3LJJud49QlvpiVN",35862,"2017-09-16"
"Roberto Parra, Angel Parra","El Chute Alberto","7k5E6xgvleaaPyHh4goL7K",34542,"2017-09-16"
"Rvssian, Bad Bunny, Farruko, Nicky Jam, Kosa","Si Tu Lo Dejas","2naJy8SKJ27gj6ZhRPDKaz",34350,"2017-09-16"
"Nicky Jam","El Amante (feat. Ozuna & Bad Bunny) - Remix","04f13iELcsYpY2yeLiAcfq",33429,"2017-09-16"
"Chyno Miranda, Wisin, Gente De Zona","Quédate Conmigo","0a9b4sUavOWgyc9jeScv7Y",33109,"2017-09-16"
"Major Lazer, Camila Cabello","Know No Better (feat. Travis Scott & Quavo) - Bad Bunny Remix","6ciFFQZcrCwSiUBZvEZrJc",32850,"2017-09-16"
"Hugo Lagos","La Rosa y el Clavel","6WTpTl6AnO8Z3EgRDSaCFt",32730,"2017-09-16"
"Yandel","No Quiero Amores (feat. Ozuna)","37sexcbewtWiE8PDuLRFrY",32339,"2017-09-16"
"Jory Boy, Bad Bunny","No Te Hagas","5hKjEpYrJIJs6uPl7zw6Y6",32199,"2017-09-16"
"Los Hidalgos","La Cueca de los Santos","04V9IEnzZ9mrKx6xt3gFOt",32091,"2017-09-16"
"Bad Bunny, Mambo Kingz, DJ Luian, Arcangel, Almighty, Bryant Myers, Noriel, BaRasta, Brytiago","Me Mata","2wgDAPgBhFA7pnIbm0YOhP",31936,"2017-09-16"
"Tito Fernández","Cueca de los Perreros","0twIQEBxVUpACRjOtQxFuv",31722,"2017-09-16"
"De La Ghetto, Daddy Yankee, Ozuna, Chris Jedi","La fórmula (feat. Chris Jeday)","4XCQtUoRSh22Ep18ULmDnT",31360,"2017-09-16"
"J Balvin, Pharrell Williams, BIA, Sky","Safari","6rQSrBHf7HlZjtcMZ4S4bO",30925,"2017-09-16"
"Farruko, Lary Over, Bad Bunny","Diabla - Official Remix","2OxUtaKYeahAGNaBiahXtR",30850,"2017-09-16"
"Charly Black, Daddy Yankee","Gyal You A Party Animal - Remix","1AkTW13ysu0AJrwuM6UY0I",29078,"2017-09-16"
"Tito Fernández","Cuecas Pa'l Colo Colo 1","2S9jTH80VA4ruIZ6IFHZLj",28954,"2017-09-16"
"Shakira","Chantaje (feat. Maluma)","6mICuAdrwEjh6Y6lroV2Kg",28825,"2017-09-16"
"Hermanos Morales","No Me Matís Con Acero","30FebxK57vTYaIVJ3qzZ24",28465,"2017-09-16"
"Calvin Harris, Funk Wav","Feels (feat. Pharrell Williams, Katy Perry & Big Sean)","5bcTCxgc7xVfSaMV3RuVke",28347,"2017-09-16"
"Roberto Parra, Angel Parra","La Perra Con el Perro","668oOKqQPe1K4jEuSWdze1",28260,"2017-09-16"
"Manuel Turizo","Una Lady Como Tú (feat. Nicky Jam) - Remix","7MMRoGvm7uhoUVhGvHJ3yW",28202,"2017-09-16"
"Jennifer Lopez","Ni Tú Ni Yo (feat. Gente de Zona)","5xMzazov0IHYllrc8U2K6F",28095,"2017-09-16"
"Bad Bunny","Soy Peor","5MT96Zz0ymUJNm8obKZQr0",27749,"2017-09-16"
"J Alvarez","Esa Boquita","3tWeAH4IYIrxV2jrUk9Ab3",27697,"2017-09-16"
"Ricky Martin","Vente Pa' Ca (feat. Maluma)","7DM4BPaS7uofFul3ywMe46",26670,"2017-09-16"
"The Weeknd, Daft Punk","I Feel It Coming","5GXAXm5YOmYT0kL5jHvYBt",26573,"2017-09-16"
"Charlie Puth","Attention","4iLqG9SeJSnt0cSPICSjxv",26543,"2017-09-16"
"Hugo Lagos","Los Lagos de Chile","3B3DVtnVjQmLjC2FZgO2xi",26478,"2017-09-16"
"Xantos, Dynell","Báilame despacio - Piso 21 Remix","7LFLJWIQFHsaDw5FOltT5Z",26368,"2017-09-16"
"Roberto Parra, Angel Parra","Ya Me Voy d'Espalda E' Loro","3OYAJDY4mA4pjiwC5X5a5l",25737,"2017-09-16"
"Tito Fernández","Cuecas Pa'l Colo Colo 2","5Awj8zb74xYGHINl0K5fHq",25657,"2017-09-16"
"Bryant Myers, Bad Bunny","Un Ratito Mas","21lnmphofXWWeSSx0PEMjc",25524,"2017-09-16"
"Chino & Nacho, Daddy Yankee","Andas En Mi Cabeza","5mey7CLLuFToM2P68Qu1gF",25435,"2017-09-16"
"Enrique Iglesias","SUBEME LA RADIO (feat. Descemer Bueno & Zion & Lennox)","7nKBxz47S9SD79N086fuhn",25408,"2017-09-16"
"JENCARLOS, Don Omar","Dure Dure","42MoYJb42qprlpJU0OEhAT",25333,"2017-09-16"
"Hermanos Morales","Tus Ojos Moreno Vide","3D6gA9PDy5D6hTE6UHRd3k",25290,"2017-09-16"
"Villa Cariño","Serenata cruel","152U4ecGSiYeKm2gnFc4wA",25237,"2017-09-16"
"Hugo Lagos","Chicha de Curacaví","7Ds48ZCIjmcWWuCeqoDOOO",25017,"2017-09-16"
"Marama, Rombai","Noche Loca","0gzcET27nREY6aD8LJU9wD",24891,"2017-09-16"
"Ozuna","Dile Que Tu Me Quieres","5u5MvmVtitax9R1Mxh3reC",24640,"2017-09-16"
"Los Hidalgos","El Volantín","3ITEjanytmAGeNYsjFXqCV",24552,"2017-09-16"
"Tito Fernández","Cuecas Pa'l Colo Colo 3","31ltKfBTtOHz1GRcrC5YZF",24442,"2017-09-16"
"Revol, Bad Bunny, Bryant Myers","Caile (feat. Zion & De La Ghetto)","626rYyBfeAeleh1F5t4B70",24270,"2017-09-16"
"Hugo Lagos","Adiós Santiago Querido","4naiGjUW7VmnkuZBavFc4h",23864,"2017-09-16"
"Arcangel","Me Acostumbre (feat. Bad Bunny)","2FIm6YsSGL5acOqSuJDh5s",23771,"2017-09-16"
"Roberto Parra, Angel Parra","El Cabritilla","1gT7zcCS8QeoqwrOawJHlQ",23647,"2017-09-16"
"Los Hidalgos","Desengáñame Con Tiempo","4uBPCMjlHaf8xXGYUjUGma",23479,"2017-09-16"
"Roberto Parra, Angel Parra","Los Pobretones Nº 1","5RINkcwZdd8UG2VQDRKSJT",23204,"2017-09-16"
"Margot Loyola","Qué Sacarán Con Querer","2OVofI6D65B4FCJuBK8ocJ",23045,"2017-09-16"
"Justin Bieber","Friends (with BloodPop®)","7nZmah2llfvLDiUjm0kiyz",23028,"2017-09-16"
"Yandel","Mi Religión","3dnOHn0A5q3ny1LLLnSAty",22930,"2017-09-16"
"Maluma","Borro Cassette","6DUdDIRgLqCGq1DwkNWQTN",22823,"2017-09-16"
"Villa Cariño","Para dormir contigo otra vez","5MarqoT4wE5uNITGuEZams",22649,"2017-09-16"
"Noche de Brujas","Deberia odiarte","0mErnrwJUNEMq6X5bu2I0u",22638,"2017-09-16"
"Luis Fonsi, Daddy Yankee, Justin Bieber","Despacito - Remix","5CtI0qwDJkDQGwXD1H1cLb",22537,"2017-09-16"
"Sebastian Yatra","Traicionera","5J1c3M4EldCfNxXwrwt8mT",22366,"2017-09-16"
"Anuel AA, Bad Bunny","La Última Vez","4J1e3hbf0e5YUZjkxyJWD3",22337,"2017-09-16"
"Hugo Lagos","La Violeta y la Parra","2VS9pHSX0vSvv7dVNq11Za",22308,"2017-09-16"
"Ozuna, J Balvin","Quiero Repetir","0MIcPSq9n2z5H8TAfEstri",22261,"2017-09-16"
"Bruno Mars","That's What I Like","0KKkJNfGyhkQ5aFogxQAPU",22247,"2017-09-16"
"Roberto Parra, Angel Parra","Los Pobretones Nº 2","5LaFsX7xieieqNqMdkifXq",22106,"2017-09-16"
"Arcangel, Bad Bunny","Tu No Vive Asi (feat. Mambo Kingz & DJ Luian)","6NSMQFKgjpQb0KkjMDYIK0",22104,"2017-09-16"
"Ed Sheeran","Shape of You (feat. Zion & Lennox) - Latin Remix","5nCtCCB5i1OfbADvynNw0i",22051,"2017-09-16"
"Shakira","Perro Fiel (feat. Nicky Jam)","70lnL3QaSOIIyMa2X9aVRL",21595,"2017-09-16"
"Brytiago, Daddy Yankee, Nicky Jam","Bebé - Remix","2jVJYU4X3aD8hlTco3MlsN",21224,"2017-09-16"
"Roberto Parra, Angel Parra","Sin Pasaporte","2Bco9w5AQOGxxM6zWsjE9d",21148,"2017-09-16"
"Xantos, Dynell","Bailame Despacio","4OaTpLJIa2harufGxfOPUu",21095,"2017-09-16"
"Sebastian Yatra, Nacho, Wisin","Alguien Robo","5i50gKdLAjjIr7UxRT5IVy",20986,"2017-09-16"
"Roberto Parra, Angel Parra","Quisiera Ser Como el Perro","3rPSxRexVxok0rDH9laGgU",20938,"2017-09-16"
"Reykon","Déjame te explico","7jzpAD8q77nwEmSsqUeUjy",20404,"2017-09-16"
"Hugo Lagos","Aló Aló","6QilzpKHYPsQFthkhbMI52",20322,"2017-09-16"
"Margot Loyola","Estando Con Llave el Pecho","0Vraj7GwMmIXN6pmBygwJE",20187,"2017-09-16"
"Moral Distraida","Hacerlo de Día","0nApFXPoSanA4n7j563Ind",20139,"2017-09-16"
"Hugo Lagos","Esa Chiquilla Que Baila","31ylK4ek48s9G0RDF8YEx2",20061,"2017-09-16"
"Bruno Mars","24K Magic","6b8Be6ljOzmkOmFslEb23P",20011,"2017-09-16"
"Trap Capos, Noriel","Amigos y Enemigos (feat. Bad Bunny & Almighty) - Remix","2sA4woGW5KgEgGXXxOKPAZ",20000,"2017-09-16"
"Sam Smith","Too Good At Goodbyes - Edit","0mel2N9Ws9r4yLQn5QE21Y",19762,"2017-09-16"
"Yandel","Sólo Mía (feat. Maluma)","1ei3g2hMYh1VKvik9FoUQR",19737,"2017-09-16"
"Roberto Parra, Angel Parra","La Bebe","2y8z6WcAWcpYsUSdZidJog",19708,"2017-09-16"
"Ozuna, Nicky Jam","Cumpleaños","6La6oWlGposkrgvLjjRJju",19678,"2017-09-16"
"Hugo Lagos","Mándame a Quitar la Vida","3MHy2HsvmcoOGsXr4SXajY",19658,"2017-09-16"
"Hugo Lagos","Esos Dos Que Están Bailando","1DkZhAkzgp3xk75apNrYnf",19495,"2017-09-16"
"Bad Bunny, Bryant Myers","Pa Ti","17nOaHsTn06jxuU9NpHuFU",19480,"2017-09-16"
"Farruko","Chillax (feat. Ky-Mani Marley)","1lxswgIpzV6HhENRvkflES",19253,"2017-09-16"
"Cali Y El Dandee, Shaggy","Lumbra","6VHdcVbiKLYYOcMbIqBcuK",19209,"2017-09-16"
"Tito Fernández","Me Gusta el Vino","4SvxLMDIfihSN0Ea3IPyDN",19041,"2017-09-16"
"Roberto Parra, Angel Parra","El Conventillo","6niIPelmGMtJbf2wr6gbwd",19023,"2017-09-16"
"ZAYN, Sia","Dusk Till Dawn - Radio Edit","1j4kHkkpqZRBwE0A4CN4Yv",18969,"2017-09-16"
"Maluma","Cuatro Babys (feat. Trap Capos, Noriel, Bryant Myers & Juhn)","0JoHqmlqE0W0i9prt6kcHR",18890,"2017-09-16"
"Alexis y Fido","Me Descontrola","3slazms3TpwswQBlwZ20hb",18855,"2017-09-16"
"Amar Azul","Yo Tomo Licor","5EHRc2WJASyZg3alJqsbqU",18848,"2017-09-16"
"Roberto Parra, Angel Parra","La Ronda","5X7NqQxR12uvV8Kqz4SsJl",18806,"2017-09-16"
"Hermanos Morales","En Santiago Se Está Viendo","3eJXyMJRMssfZmUP9H0pa3",18804,"2017-09-16"
"Santaferia","El Gil de Tu Ex","3cUE3p7E39CzGjQoEsg7sM",18803,"2017-09-16"
"Noche de Brujas","Oyeme","0zsbeQtP0KZ9hXabeCHqo2",18591,"2017-09-16"
"Camila Cabello, Young Thug","Havana","0ofbQMrRDsUaVKq2mGLEAb",18539,"2017-09-16"
"Trap Capos, Noriel, Yandel","Doble Personalidad","6F23RA4YzxmSOS7StCKEXb",18411,"2017-09-16"
"Chayanne","Qué Me Has Hecho (feat. Wisin)","3nUNwSYEUv9bmUc3de0Owv",18363,"2017-09-16"
"Maroon 5","What Lovers Do (feat. SZA)","4mxWSdf71VFO52qFeY0fZt",18311,"2017-09-16"
"Noche de Brujas","La Besé - Remaster","3A2vH1cqcMW61wVwZFMLaV",18246,"2017-09-16"
"Roberto Parra, Angel Parra","Ya Se Fue el 71","69MuDgCcfrYvnxkxFJ0pEN",18144,"2017-09-16"
"Shawn Mendes","There's Nothing Holdin' Me Back","79cuOz3SPQTuFrp8WgftAu",18117,"2017-09-16"
"Bryant Myers","Pa Pasar El Rato","1v785WZqLWlA9bwsIfqBJV",18116,"2017-09-16"
"Hermanos Morales","Yo Ví una Chiquilla Linda","6pL9DRZGc6WZ0Zto2VmHoQ",18092,"2017-09-16"
"DJ Snake, Justin Bieber","Let Me Love You","4pdPtRcBmOSQDlJ3Fk945m",17761,"2017-09-16"
"Drake, WizKid, Kyla","One Dance","1xznGGDReH1oQq0xzbwXa3",17680,"2017-09-16"
"Jonas Blue, William Singe","Mama","0NiXXAI876aGImAd6rTj8w",17530,"2017-09-16"
"Juan Magán, Nacho, Pasabordo","Sígueme Bailando","1fiwHsiitsbudIjFgmzrM4",17412,"2017-09-16"
"Imagine Dragons","Believer","0CcQNd8CINkwQfe1RDtGV6",17371,"2017-09-16"
"Bad Bunny, Farruko, DJ Luian, Mambo Kingz","Blockia","3uPLiBTUgz7wrGJ2mw1rzM",17256,"2017-09-16"
"Mon Laferte","Tu Falta De Querer","4skuEIloXWuxxgekKupkEH",17241,"2017-09-16"
"CNCO, Little Mix","Reggaetón Lento (Remix)","3zoYkqS4y2BsGVShPL2nTE",17167,"2017-09-16"
"Carlos Vives, Shakira","La Bicicleta","0sXvAOmXgjR2QUqLK1MltU",17043,"2017-09-16"
"Imagine Dragons","Thunder","0tKcYR2II1VCQWT79i5NrW",16981,"2017-09-16"
"Bryant Myers, Ñejo","Hablame Claro","1QS4201reOvarHePcxOAk1",16954,"2017-09-16"
"Demi Lovato","Sorry Not Sorry","25C5CowdsfXld2jJanbiex",16832,"2017-09-16"
"Clean Bandit","Rockabye (feat. Sean Paul & Anne-Marie)","5knuzwU65gJK7IF5yJsuaW",16710,"2017-09-16"
"Daddy Yankee","Shaky Shaky","58IL315gMSTD37DOZPJ2hf",16626,"2017-09-16"
"Rafaga","Una Cerveza","3LNZSTiwQYL7BnTfHvIOII",16530,"2017-09-16"
"Noche de Brujas","Me gusta todo de ti","0WBpK4TdYkkRtpYaGixO2x",16455,"2017-09-16"
"Zion & Lennox","Mi tesoro (feat. Nicky Jam)","5HABnFSYvl6mTmg8nSdzHa",16434,"2017-09-16"
"Rombai","Una y Otra Vez","3VSt7R9LHTomKGP1RhkvuT",16405,"2017-09-16"
"Pepe Quintana, Ñengo Flow","Si Me Muero (feat. Farruko, Lary Over, Nengo Flow & Darell)","7gLApUvGknNvpqeRtgp7S9",16250,"2017-09-16"
"Valentino, Manuel Turizo","Besame","7Ckhk1XW5NV2k4jpqtQNlz",16229,"2017-09-16"
"DJ Khaled","Wild Thoughts (feat. Rihanna & Bryson Tiller)","1OAh8uOEOvTDqkKFsKksCi",16122,"2017-09-16"
"Gente De Zona","Si No Vuelves","0PE1dlvMZeBqEbm4BtVVSZ",15829,"2017-09-16"
"Charlie Puth","We Don't Talk Anymore (feat. Selena Gomez)","68EMU2RD1ECNeOeJ5qAXCV",15653,"2017-09-16"
"Avicii","Without You (feat. Sandro Cavazza)","6WbADFqMvR8N5u0BvtsWQE",15558,"2017-09-16"
"XXXTENTACION","Jocelyn Flores","7m9OqQk4RVRkw9JJdeAw96",15481,"2017-09-16"
"Louis Tomlinson","Back to You (feat. Bebe Rexha & Digital Farm Animals)","7F9vK8hNFMml4GtHsaXui6",15394,"2017-09-16"
"The Chainsmokers, Coldplay","Something Just Like This","6RUKPb4LETWmmr3iAEQktW",15387,"2017-09-16"
"Cami","Un Poco Más De Frío","3ZGLzkuKPU2ngeicx6LqOb",15385,"2017-09-16"
"Ozuna, Cosculluela, Revol","Me Ama Me Odia","6041gM9Th1ViQcnzkIxnuv",15373,"2017-09-16"
"La Combo Tortuga","Soy Feo Pero Rico","7wKrYpEkIa4NNSwkd1YqRQ",15366,"2017-09-16"
"La Combo Tortuga","Te Vuelvo a Ver","2NItmgHAUnsICEWIY5DQmj",15339,"2017-09-16"
"Luny Tunes, Daddy Yankee, Wisin, Don Omar, Yandel","Mayor Que Yo 3","0bMRpUsk1IWi5O2NIkWsqR",15316,"2017-09-16"
"French Montana, Swae Lee","Unforgettable","3B54sVLJ402zGa6Xm4YGNe",15230,"2017-09-16"
